title,slug,short_description,long_description,category,provider,source_url,licence,update_frequency,format,record_count,date_coverage,geographic_coverage,access_method,schema_fields,sample_rows,tags,access_type,priority,notes
London Building Stock Model (LBSM),296oy,"The Mayor is committed to cutting fuel poverty and increasing the energy efficiency of buildings across London. To help target where action is most needed,...","The Mayor is committed to cutting fuel poverty and increasing the energy efficiency of buildings across London. To help target where action is most needed, the Mayor has developed a London Building Stock Model with the UCL Energy Institute . The London Building Stock Model is a database of all the energy and carbon data collected through the Mayor’s energy programmes and policies. It provides a snapshot of all London’s buildings (both domestic and non-domestic) with information on their energy performance certificates as of 2017. More information is available here , and an interactive map is available here . Most of the data from the London Building Stock Model interactive map has been made available through the data extracts below. Please note that the data extracts are based on Ordnance ",Environment,Greater London Authority (GLA),https://data.london.gov.uk/dataset/296oy,UK Open Government Licence (OGL v3) — http://www.nationalarchives.gov.uk/doc/open-government-licence/version/3/,Unknown,"CSV, SPREADSHEET, ZIP",UNKNOWN,UNKNOWN,Greater London,Free download,UNKNOWN — requires accessing dataset page directly,UNKNOWN — requires accessing dataset page directly,,snowflake,Medium,"Topics: environment, housing. Last updated: 2023-07-04."
London's Zero Carbon Pathways Tool,2r4xm,"London’s Zero Carbon Pathways Tool shows four ways that carbon emissions might be reduced to net zero by 2030. The Tool, developed by Element Energy,...","London’s Zero Carbon Pathways Tool shows four ways that carbon emissions might be reduced to net zero by 2030. The Tool, developed by Element Energy, accompanies the report “ Analysis of a Net Zero 2030 Target for Greater London ” also written by Element Energy. This report should be read in conjunction with the tool for an explanation of the assumptions behind the four pathways. In the Tool, energy and carbon results are presented by sector, as well as some sector specific results such as vehicle kilometres for transport and supply by fuel type for district heat. Modelling has been done on a pan-London basis, so borough level results are an estimate only. This Zero Carbon Pathways Tool is an update of an earlier tool published in 2018, which showed pathways to net zero emissions by 2050. ",Environment,Greater London Authority (GLA),https://data.london.gov.uk/dataset/2r4xm,UK Open Government Licence (OGL v3) — http://www.nationalarchives.gov.uk/doc/open-government-licence/version/3/,One off,SPREADSHEET,UNKNOWN,2015-01 to 2050-12,Middle Super Output Area,Free download,UNKNOWN — requires accessing dataset page directly,UNKNOWN — requires accessing dataset page directly,,snowflake,Medium,"Topics: environment, planning, transport. Last updated: 2023-05-10."
LAEI 2019 - Borough Air Quality Data for LLAQM,2zjgq,"Following the release of the latest London Atmospheric Emissions Inventory (LAEI) 2019 , additional data has been produced at Borough level, to assist...","Following the release of the latest London Atmospheric Emissions Inventory (LAEI) 2019 , additional data has been produced at Borough level, to assist London boroughs with their LLAQM (London Local Air Quality Management) duties. The data below is based on the NO x , NO 2 , PM 10 and PM 2.5 emissions and ground level NO x , NO 2 and PM concentrations already published as part of the LAEI 2019. It includes the following datasets, which can be downloaded below: Maps of ground level concentrations across each borough for NO x , NO 2 , PM 2.5 (annual mean), and PM 10 (both annual mean and number of daily means over 50µg/m 3 ) for years 2019, 2025 and 2030. Maps are provided as JPG and PDF files, and in two versions: one with an OS base map included (Conc2) and one without it (Conc1). Dashboard",Environment,GLA and TFL Air Quality,https://data.london.gov.uk/dataset/2zjgq,UNKNOWN,Unknown,ZIP,UNKNOWN,UNKNOWN,Greater London,Free download,UNKNOWN — requires accessing dataset page directly,UNKNOWN — requires accessing dataset page directly,,snowflake,Medium,"Topics: environment, health, transport. Last updated: 2023-04-25."
Air Quality Monitoring Sites,23n41,Location of monitoring stations from- London Air Quality Network (https://www.londonair.org.uk/LondonAir/General/about.aspx)- AQE...,"Location of monitoring stations from- London Air Quality Network (https://www.londonair.org.uk/LondonAir/General/about.aspx)- AQE (https://www.airqualityengland.co.uk/)- Breathe London (These monitors are part of a new study in London called 'Breathe London'that is testing out lower cost monitors across the city, for more information on the Breathe London project please see here-https://www.breathelondon.org/)A range of pollutants are typically monitored including NOx, particulates, CO2 and SO2, but vary from site to site.",Environment,Greater London Authority (GLA),https://data.london.gov.uk/dataset/23n41,Creative Commons Attribution — http://www.opendefinition.org/licenses/cc-by,Annual,"GEOPACKAGE, HTML",UNKNOWN,UNKNOWN,Coordinates,Free download,UNKNOWN — requires accessing dataset page directly,UNKNOWN — requires accessing dataset page directly,"LAEI, AQ, Kings, C40, MapLondon, airqualitymap",snowflake,Medium,"Topics: environment, health. Last updated: 2023-02-09."
"Electricity Consumption, Borough",24rnx,Electricity consumption by sector. Data for Middle Super Output Areas (MSOA) also available. Department for Environment and Climate Change are carrying out...,Electricity consumption by sector. Data for Middle Super Output Areas (MSOA) also available. Department for Environment and Climate Change are carrying out further analysis of the consistency between the 2008 sub-national data and the 2008 data published at UK level in the Digest of UK energy statistics; at this stage we recommend that users consider that these data are provisional. Read DECCs quarterly publication 'Energy Trends' for further information. Data on DECC website,Environment,"Department for Business, Energy & Industrial Strategy (BEIS)",https://data.london.gov.uk/dataset/24rnx,UK Open Government Licence (OGL v2) — http://www.nationalarchives.gov.uk/doc/open-government-licence/version/2/,Annual,SPREADSHEET,UNKNOWN,2003-01 to 2021-12,Local Authority,Free download,UNKNOWN — requires accessing dataset page directly,UNKNOWN — requires accessing dataset page directly,"consumption, energy, electricity, resources",snowflake,Medium,Topics: environment. Last updated: 2023-02-07.
London-wide Ultra Low Emission Zone Expansion 2023,296nj,"To help clear London's air and improve public health, the Ultra Low Emission Zone (ULEZ) is expanding across all London boroughs from 29 August 2023. The...","To help clear London's air and improve public health, the Ultra Low Emission Zone (ULEZ) is expanding across all London boroughs from 29 August 2023. The current ULEZ covers inner London up to (but not including) the North and South Circular Roads. The new boundary will be the same as the existing London-wide Low Emission Zone. For more information on the ULEZ expansion please visit: ﻿ https://tfl.gov.uk/modes/driving/ultra-low-emission-zone/ulez-expansion-2023",Environment,GLA and TFL Air Quality,https://data.london.gov.uk/dataset/296nj,UNKNOWN,One off,ZIP,UNKNOWN,UNKNOWN,Greater London,Free download,UNKNOWN — requires accessing dataset page directly,UNKNOWN — requires accessing dataset page directly,"ULEZ, Transportation, Air Quality",snowflake,Medium,"Topics: environment, transport. Last updated: 2023-01-17."
London Borough of Tower Hamlets Waste Strategy,vd43m,"Please note document ""6.5 LBTH Landlord Data v2.0.xlsx"" has not been uploaded to this datastore page. Contact Planning.ICS@london.gov.uk to request access.","Please note document ""6.5 LBTH Landlord Data v2.0.xlsx"" has not been uploaded to this datastore page. Contact Planning.ICS@london.gov.uk to request access.",Environment,GLA Infrastructure Coordination Service,https://data.london.gov.uk/dataset/vd43m,Other (Open),One off,"PDF, SPREADSHEET",UNKNOWN,UNKNOWN,Borough,Free download,UNKNOWN — requires accessing dataset page directly,UNKNOWN — requires accessing dataset page directly,"waste, strategy, tower hamlets",snowflake,Medium,"Topics: environment, planning. Last updated: 2022-12-16."
Inequalities and Environmental Action,emxyp,"This report and dataset were commissioned by the Greater London Authority, and produced by Centric Lab to uncover the work of community groups that connect...","This report and dataset were commissioned by the Greater London Authority, and produced by Centric Lab to uncover the work of community groups that connect with environmental issues in Hackney, Newham, Tower Hamlets and Waltham Forest. These four boroughs were selected as they have some of the highest representation of multi-ethnic low income communities who were greatly affected by the coronavirus pandemic. Many reports highlighted the role of environmental pollutants and structural deprivation as a determinant of Covid-19 infection and impact. As evidenced in this report communities demonstrate numerous and diverse capabilities in tackling the structural challenges of modern day London. This report highlights the different community groups committed to improving the lives of their famili",Environment,Greater London Authority (GLA),https://data.london.gov.uk/dataset/emxyp,UNKNOWN,One off,"PDF, SPREADSHEET",UNKNOWN,UNKNOWN,Local Authority,Free download,UNKNOWN — requires accessing dataset page directly,UNKNOWN — requires accessing dataset page directly,,snowflake,Medium,"Topics: environment, health, income-poverty-welfare. Last updated: 2022-07-28."
Housing Zones,24yxz,Housing zones are areas funded by the Mayor and government to attract developers and relevant partners to build new homes. The GIS files show the indicative...,"Housing zones are areas funded by the Mayor and government to attract developers and relevant partners to build new homes. The GIS files show the indicative boundaries, please contact the relevant London Borough to confirm accuracy. NOTE: The boundaries are based on Ordnance Survey mapping and the data is published under Ordnance Survey's 'presumption to publish'.Contains OS data © Crown copyright and database rights 2019. Greater London Authority - Contains public sector information licensed under the Open Government Licence v3.0",Environment,Planning Constraints Map,https://data.london.gov.uk/dataset/24yxz,UK Open Government Licence (OGL v3) — http://www.nationalarchives.gov.uk/doc/open-government-licence/version/3/,Unknown,"GEOPACKAGE, HTML",UNKNOWN,UNKNOWN,Custom Polygons,Free download,UNKNOWN — requires accessing dataset page directly,UNKNOWN — requires accessing dataset page directly,"planningconstraintsmap, MapLondon",snowflake,Medium,"Topics: environment, housing, planning. Last updated: 2022-07-12."
Safeguarded Wharves,2g90r,Safeguarded Wharves are wharves that are given protected status as working wharves to help the Thames maintain its cargo-handling function. It is not...,"Safeguarded Wharves are wharves that are given protected status as working wharves to help the Thames maintain its cargo-handling function. It is not allowed to use safeguarded wharves for non-port activities and all planning applications affecting the wharves must be referred to the Mayor. The GIS files show the indicative boundaries, please contact the relevant London Borough to confirm accuracy. NOTE: The boundaries are based on Ordnance Survey mapping and the data is published under Ordnance Survey's 'presumption to publish'.Contains OS data © Crown copyright and database rights 2019. Greater London Authority - Contains public sector information licensed under the Open Government Licence v3.0",Environment,Planning Constraints Map,https://data.london.gov.uk/dataset/2g90r,UK Open Government Licence (OGL v3) — http://www.nationalarchives.gov.uk/doc/open-government-licence/version/3/,Unknown,"GEOPACKAGE, HTML",UNKNOWN,UNKNOWN,Custom Polygons,Free download,UNKNOWN — requires accessing dataset page directly,UNKNOWN — requires accessing dataset page directly,"planningconstraintsmap, MapLondon",snowflake,Medium,"Topics: environment, housing, planning. Last updated: 2022-07-12."
Article 4 directions: office to residential,2gy3r,An Article 4 Direction: Office to Residential removes permitted development rights within the designated area. This means you will need planning permission...,"An Article 4 Direction: Office to Residential removes permitted development rights within the designated area. This means you will need planning permission from the LPAs for a change of use from office (Use Class B1a) to residential (Use Class C3). The GIS files show the indicative boundaries, please contact the relevant London Borough to confirm accuracy. NOTE: The boundaries are based on Ordnance Survey mapping and the data is published under Ordnance Survey's 'presumption to publish'.Contains OS data © Crown copyright and database rights 2019. Greater London Authority - Contains public sector information licensed under the Open Government Licence v3.0",Environment,Planning Constraints Map,https://data.london.gov.uk/dataset/2gy3r,UK Open Government Licence (OGL v3) — http://www.nationalarchives.gov.uk/doc/open-government-licence/version/3/,Unknown,"GEOPACKAGE, HTML",UNKNOWN,UNKNOWN,Custom Polygons,Free download,UNKNOWN — requires accessing dataset page directly,UNKNOWN — requires accessing dataset page directly,"planningconstraintsmap, MapLondon",snowflake,Medium,"Topics: environment, housing, planning. Last updated: 2022-07-12."
Planning Data Map,2lzrg,This is a beta version of the first open planning data map for London. It contains 16 data sets grouped under the headings of 'Good Growth' and...,"This is a beta version of the first open planning data map for London. It contains 16 data sets grouped under the headings of 'Good Growth' and 'Constraints'. You are encouraged to explore the map and give us your ideas about how it can be improved. We are also keen to receive suggestions for what information to add next. Please send your feedback to planningdata@london.gov.uk For more information about planning, please see www.london.gov.uk/what-we-do/planning",Environment,Planning Constraints Map,https://data.london.gov.uk/dataset/2lzrg,UK Open Government Licence (OGL v3) — http://www.nationalarchives.gov.uk/doc/open-government-licence/version/3/,Weekly,HTML,UNKNOWN,UNKNOWN,Custom Polygons,Free download,UNKNOWN — requires accessing dataset page directly,UNKNOWN — requires accessing dataset page directly,planningconstraintsmap,snowflake,Medium,"Topics: environment, housing, planning. Last updated: 2022-06-16."
Londoners' awareness and understanding of retrofitting ,2r7ko,Qualitative research (focus groups) and representative polling undertaken by the GLA's Opinion Research team in February 2022. Focus groups were split by...,Qualitative research (focus groups) and representative polling undertaken by the GLA's Opinion Research team in February 2022. Focus groups were split by income and by housing tenure. The research explored: To what extent are Londoners aware of retrofitting? To what extent are Londoners currently willing to retrofit their homes? What might encourage Londoners to consider retrofitting? What information do they have / need?,Environment,GLA Opinion Research,https://data.london.gov.uk/dataset/2r7ko,UK Open Government Licence (OGL v3) — http://www.nationalarchives.gov.uk/doc/open-government-licence/version/3/,One off,PDF,UNKNOWN,UNKNOWN,Greater London,Free download,UNKNOWN — requires accessing dataset page directly,UNKNOWN — requires accessing dataset page directly,,snowflake,Medium,"Topics: environment, housing. Last updated: 2022-05-16."
Low Carbon Technologies,236z3,Volume of Low Carbon Technologies (LCT) for both generation and demand (under 1MW) connected to UK Power Networks by Primary Substation. Examples of LCTs...,Volume of Low Carbon Technologies (LCT) for both generation and demand (under 1MW) connected to UK Power Networks by Primary Substation. Examples of LCTs include electric vehicle charge points and solar PV.,Environment,UK Power Networks,https://data.london.gov.uk/dataset/236z3,Creative Commons Attribution — http://www.opendefinition.org/licenses/cc-by,Monthly,HTML,UNKNOWN,UNKNOWN,100m Grid Squares,Free download,UNKNOWN — requires accessing dataset page directly,UNKNOWN — requires accessing dataset page directly,"electricity, low carbon, EV, electric vehicle, PV, Heat pumps, power, heat",snowflake,Medium,"Topics: environment, planning, transport. Last updated: 2022-05-13."
Isle of Dogs and South Poplar Integrated Water Management Plan,em58m,An Integrated Water Management Plan (IWMP) for the Isle of Dogs and South Poplar Opportunity Area prepared by the Greater London Authority in partnership...,"An Integrated Water Management Plan (IWMP) for the Isle of Dogs and South Poplar Opportunity Area prepared by the Greater London Authority in partnership with LB Tower Hamlets, also encompassing the ‘East of Borough’ area adjacent to the River Lea. The IWMP considers the constraints and opportunities for sustainably managing water supply, demand and drainage in the study area in the context of the significant residential and commercial development anticipated over the coming decades. It provides a series of prioritised recommendations for the borough, water providers, developers and other key stakeholders to consider for implementation.",Environment,Greater London Authority (GLA),https://data.london.gov.uk/dataset/em58m,UK Open Government Licence (OGL v3) — http://www.nationalarchives.gov.uk/doc/open-government-licence/version/3/,One off,"PDF, ZIP",UNKNOWN,UNKNOWN,Greater London,Free download,UNKNOWN — requires accessing dataset page directly,UNKNOWN — requires accessing dataset page directly,,snowflake,Medium,"Topics: environment, planning. Last updated: 2022-05-09."
Grid and Primary substations,e66k9,"List of Active Grid and Primary Sites and key characteristics including spatial coordinates, year commissioned and asset counts against the site.List of...","List of Active Grid and Primary Sites and key characteristics including spatial coordinates, year commissioned and asset counts against the site.List of Active Grid and Primary Sites and key characteristics including spatial coordinates, year commissioned and asset counts against the site.",Environment,UK Power Networks,https://data.london.gov.uk/dataset/e66k9,Creative Commons Attribution — http://www.opendefinition.org/licenses/cc-by,Annual,HTML,UNKNOWN,UNKNOWN,100m Grid Squares,Free download,UNKNOWN — requires accessing dataset page directly,UNKNOWN — requires accessing dataset page directly,"electricity, power, substation",snowflake,Medium,"Topics: environment, planning. Last updated: 2022-05-06."
SmartMeter Energy Consumption Data in London Households,vqm0d,"Energy consumption readings for a sample of 5,567 London Households that took part in the UK Power Networks led Low Carbon London project between November...","Energy consumption readings for a sample of 5,567 London Households that took part in the UK Power Networks led Low Carbon London project between November 2011 and February 2014. Readings were taken at half hourly intervals. The customers in the trial were recruited as a balanced sample representative of the Greater London population. The dataset contains energy consumption, in kWh (per half hour), unique household identifier, date and time. The CSV file is around 10GB when unzipped and contains around 167million rows. Within the data set are two groups of customers. The first is a sub-group, of approximately 1100 customers, who were subjected to Dynamic Time of Use (dToU) energy prices throughout the 2013 calendar year period. The tariff prices were given a day ahead via the Smart Meter I",Environment,UK Power Networks,https://data.london.gov.uk/dataset/vqm0d,Creative Commons Attribution — http://www.opendefinition.org/licenses/cc-by,Unknown,"SPREADSHEET, ZIP",UNKNOWN,2011-11 to 2014-02,Other,Free download,UNKNOWN — requires accessing dataset page directly,UNKNOWN — requires accessing dataset page directly,"2013, electricity, power, energy",snowflake,Medium,Topics: environment. Last updated: 2022-04-07.
Low Carbon London Heat Pump Load Profiles,2nlrm,"Data was collected relating to load profiles for 19 customers as part of the Low Carbon London project, delivered by UK Power Networks. Data has been...","Data was collected relating to load profiles for 19 customers as part of the Low Carbon London project, delivered by UK Power Networks. Data has been anonymised. Two folders, correspond to two suppliers – data is offered differently from the two suppliers. The folder ‘Data Supply 1’ contains two folders as Power Quality is logged separately from Heat Profiles. For further queries contact innovation@ukpowernetworks.co.uk Variation from the specification None of the power quality meters were capable of recording specific harmonic phase, therefore only harmonic magnitudes are recorded. The Enetics power quality meters record to a maximum of the 25th harmonic No power quality data for S1_Customer 6 or 8",Environment,UK Power Networks,https://data.london.gov.uk/dataset/2nlrm,Creative Commons Attribution — http://www.opendefinition.org/licenses/cc-by,Unknown,ZIP,UNKNOWN,UNKNOWN,Greater London,Free download,UNKNOWN — requires accessing dataset page directly,UNKNOWN — requires accessing dataset page directly,,snowflake,Medium,Topics: environment. Last updated: 2022-04-07.
Photovoltaic (PV) Solar Panel Energy Generation data,2nlqm,"This dataset contains voltage, current, power, energy, and weather data from low-voltage substations and domestic premises with high uptake of solar...","This dataset contains voltage, current, power, energy, and weather data from low-voltage substations and domestic premises with high uptake of solar photovoltaic (PV) embedded generation. Data collected as part of the project run by UK Power Networks. Validation of Photovoltaic Connection Assessment Tool https://www.ofgem.gov.uk/ofgem-publications/93938/pvtoolcdrfinal-pdf The project collected a rich dataset at domestic sites with Solar Panels. The data set comprises of 25,775 days-worth of data, and over 171 million individual measurements. Key stats about the dataset: 20 substations and 10 domestic premises Collected over 480 days - 27 July 2013 to 19 November 2014 10 minute intervals over all time recorded, 1 minute intervals in summer 2014 10-minute measurements prior to 10 June 2014, ",Environment,UK Power Networks,https://data.london.gov.uk/dataset/2nlqm,Creative Commons Attribution — http://www.opendefinition.org/licenses/cc-by,Unknown,"SPREADSHEET, ZIP",UNKNOWN,2013-11 to 2014-11,Other,Free download,UNKNOWN — requires accessing dataset page directly,UNKNOWN — requires accessing dataset page directly,,snowflake,Medium,Topics: environment. Last updated: 2022-04-07.
Low Carbon London Electric Vehicle Load Profiles,2y5k8,"Data collected relating to load profiles for electric vehicle charging, part of the Low Carbon London (LCL) project delivered by UK Power Networks. Data has...","Data collected relating to load profiles for electric vehicle charging, part of the Low Carbon London (LCL) project delivered by UK Power Networks. Data has been anonymised. For further queries contact innovation@ukpowernetworks.co.uk Folders: EV Commercial trials Folder contains raw data from LCL EV commercial trials (2013 - 2014) Files ordered by customer with ten-minute time stamps of EV activity. EV Public trials List of charging events of four different suppliers of public charge points. EV Residential trials Folder contains raw data from LCL EV residential trials (2013 - 2014) – sorted by customer. Files ordered by customer with ten-minute time stamps of EV activity. Also contained are anonymised surveys about EV habits.",Environment,UK Power Networks,https://data.london.gov.uk/dataset/2y5k8,Creative Commons Attribution — http://www.opendefinition.org/licenses/cc-by,Unknown,ZIP,UNKNOWN,UNKNOWN,Greater London,Free download,UNKNOWN — requires accessing dataset page directly,UNKNOWN — requires accessing dataset page directly,,snowflake,Medium,Topics: environment. Last updated: 2022-04-07.
