title,slug,short_description,long_description,category,provider,source_url,licence,update_frequency,format,record_count,date_coverage,geographic_coverage,access_method,schema_fields,sample_rows,tags,access_type,priority,notes
Coronavirus (COVID-19) Deaths,2l19x,Due to changes in the collection and availability of data on COVID-19 this page will no longer be updated. The webpage will no longer be available as of 11...,"Due to changes in the collection and availability of data on COVID-19 this page will no longer be updated. The webpage will no longer be available as of 11 May 2023. On-going, reliable sources of data for COVID-19 are available via the COVID-19 dashboard, Office for National Statistics, and the UKHSA This page provides a weekly summary of data on deaths related to COVID-19 published by NHS England and the Office for National Statistics. More frequent reporting on COVID-19 deaths is now available here , alongside data on cases, hospitalisations, and vaccinations. This update contains data on deaths related to COVID-19 from: NHS England COVID-19 Daily Deaths - last updated on 28 June 2022 with data up to and including 27 June 2022. ONS weekly deaths by Local Authority - last updated on 16 Au",Health,Greater London Authority (GLA),https://data.london.gov.uk/dataset/2l19x,UK Open Government Licence (OGL v3) — http://www.nationalarchives.gov.uk/doc/open-government-licence/version/3/,Weekly,CSV,UNKNOWN,UNKNOWN,Region,Free download,UNKNOWN — requires accessing dataset page directly,UNKNOWN — requires accessing dataset page directly,,snowflake,Medium,"Topics: covid-19, demographics, health. Last updated: 2023-04-12."
Coronavirus (COVID-19) Weekly Update,e6yg0,"Dataset no longer updated: Due to changes in the collection and availability of data on COVID-19, this dataset is no longer updated. Latest information...","Dataset no longer updated: Due to changes in the collection and availability of data on COVID-19, this dataset is no longer updated. Latest information about COVID-19 is available via the UKHSA data dashboard . The UK government publish daily data, updated weekly, on COVID-19 cases, vaccinations, hospital admissions and deaths. This note provides a summary of the key data for London from this release. Data are published through the UK Coronavirus Dashboard , last updated on 23 March 2023. This update contains: Data on the number of cases identified daily through Pillar 1 and Pillar 2 testing at the national, regional and local authority level Data on the number of people who have been vaccinated against COVID-19 Data on the number of COVID-19 patients in Hospital Data on the number of peop",Health,Greater London Authority (GLA),https://data.london.gov.uk/dataset/e6yg0,UNKNOWN,Daily,CSV,UNKNOWN,UNKNOWN,Borough,Free download,UNKNOWN — requires accessing dataset page directly,UNKNOWN — requires accessing dataset page directly,COVID-19,snowflake,Medium,"Topics: covid-19, health. Last updated: 2023-03-29."
Coronavirus (COVID-19) Mobility Report,2j036,"Due to changes in the collection and availability of data on COVID-19, this website will no longer be updated. The webpage will no longer be available as of...","Due to changes in the collection and availability of data on COVID-19, this website will no longer be updated. The webpage will no longer be available as of 11 May 2023. On-going, reliable sources of data for COVID-19 are available via the COVID-19 dashboard and the UKHSA GLA Covid-19 Mobility Report Since March 2020, London has seen many different levels of restrictions - including three separate lockdowns and many other tiers/levels of restrictions, as well as easing of restrictions and even measures to actively encourage people to go to work, their high streets and local restaurants. This reports gathers data from a number of sources, including google, apple, citymapper, purple wifi and opentable to assess the extent to which these levels of restrictions have translated to a reductions ",Health,Greater London Authority (GLA),https://data.london.gov.uk/dataset/2j036,UNKNOWN,Weekly,"CSV, SPREADSHEET",UNKNOWN,UNKNOWN,Greater London,Free download,UNKNOWN — requires accessing dataset page directly,UNKNOWN — requires accessing dataset page directly,"Busyness, highstreetdata",snowflake,Medium,Topics: covid-19. Last updated: 2022-11-07.
GLA COVID-19 vaccine polling,2l1z3,"This page contains GLA public polling data on Londoners' attitudes towards the COVID-19 vaccine, including likelihood to take the vaccine. All figures,...","This page contains GLA public polling data on Londoners' attitudes towards the COVID-19 vaccine, including likelihood to take the vaccine. All figures, unless otherwise stated, are from YouGov Plc on behalf of the GLA. The surveys were carried out online. The figures have been weighted and are representative of all London adults (aged 18+).",Health,GLA Opinion Research,https://data.london.gov.uk/dataset/2l1z3,UNKNOWN,Unknown,SPREADSHEET,UNKNOWN,UNKNOWN,Greater London,Free download,UNKNOWN — requires accessing dataset page directly,UNKNOWN — requires accessing dataset page directly,COVID-19,snowflake,Medium,Topics: covid-19. Last updated: 2022-06-07.
More than just education: A Participatory Action Research project on adult education in London,2gjdr,This is a Toynbee Hall report on adult education commissioned by the Greater London Authority (GLA) to inform the preparation of the Mayor’s Skills Roadmap...,This is a Toynbee Hall report on adult education commissioned by the Greater London Authority (GLA) to inform the preparation of the Mayor’s Skills Roadmap for London. For this project Toynbee Hall worked with a group of peer researchers who had lived experience of being part of one or more of the priority groups identified by the GLA as having the most to gain from adult education. Over the course of five months peer researchers co-designed and co-produced the research and conducted in-depth interviews with over 50 people from across London about how adult education services could be improved. For this project Toynbee Hall adopted a Participatory Action Research (PAR) approach. This style of research involves professional researchers and members of communities (peer researchers) working i,Health,Greater London Authority (GLA),https://data.london.gov.uk/dataset/2gjdr,UNKNOWN,One off,PDF,UNKNOWN,UNKNOWN,Greater London,Free download,UNKNOWN — requires accessing dataset page directly,UNKNOWN — requires accessing dataset page directly,,snowflake,Medium,"Topics: covid-19, education, employment-and-skills, income-poverty-welfare. Last updated: 2022-04-26."
Summaries of external research on COVID-19,2kn73,This newsletter series presents a digest of external research that the Greater London Authority (GLA) is making available for the benefit of external...,"This newsletter series presents a digest of external research that the Greater London Authority (GLA) is making available for the benefit of external stakeholders in tackling the COVID-19 crisis. The City Intelligence Unit at the GLA started to produce the newsletters in April, initially as an internal product for staff in the organisation and in its functional bodies. As from 2nd June, past and current issues have been made available for download. These summaries have been prepared under challenging circumstances and to short timescales. They are not intended to be comprehensive and exhaustive and the do not represent the full body of evidence on which Mayoral Policies are or will be based. Each briefing will offer short summaries and a deep dive into one or two topics.",Health,Greater London Authority (GLA),https://data.london.gov.uk/dataset/2kn73,UNKNOWN,Unknown,PDF,UNKNOWN,2020-04 to 2021-11,Greater London,Free download,UNKNOWN — requires accessing dataset page directly,UNKNOWN — requires accessing dataset page directly,,snowflake,Medium,Topics: covid-19. Last updated: 2021-11-03.
Food access for night time workers,2yp6y,Qualitative research undertaken by the GLA's Opinion Research team in 2020. The research explored in-depth the experiences of those who work night shifts in...,"Qualitative research undertaken by the GLA's Opinion Research team in 2020. The research explored in-depth the experiences of those who work night shifts in London hospitals (nurses, student nurses, and cleaners); their access to food during these shifts; and their subsequent ability to maintain a healthy diet. The research report covers: Positives and negatives of working at night in a hospital Barriers to accessing healthy food for night time health workers The most effective interventions to support those who work at night maintain a healthy diet and lifestyle",Health,GLA Opinion Research,https://data.london.gov.uk/dataset/2yp6y,UK Open Government Licence (OGL v3) — http://www.nationalarchives.gov.uk/doc/open-government-licence/version/3/,One off,PDF,UNKNOWN,UNKNOWN,Greater London,Free download,UNKNOWN — requires accessing dataset page directly,UNKNOWN — requires accessing dataset page directly,,snowflake,Medium,"Topics: covid-19, health. Last updated: 2021-10-29."
Briefing: Demographic impact of Covid-19,2j0m6,"This briefing brings together a range of data published on the demographic impact of Covid19 to understand how the city has been affected, covering what is...","This briefing brings together a range of data published on the demographic impact of Covid19 to understand how the city has been affected, covering what is known about Covid-19 cases, before looking at mortality. It provides comparisons with other cities and explains some of the issues which affect the accuracy of such comparisons. And it summarises the emerging evidence of unequal impacts for different demographic groups, especially ethnicity and workers in particular occupations.",Health,Greater London Authority (GLA),https://data.london.gov.uk/dataset/2j0m6,UK Open Government Licence (OGL v3) — http://www.nationalarchives.gov.uk/doc/open-government-licence/version/3/,Unknown,PDF,UNKNOWN,UNKNOWN,Borough,Free download,UNKNOWN — requires accessing dataset page directly,UNKNOWN — requires accessing dataset page directly,,snowflake,Medium,Topics: covid-19. Last updated: 2021-10-21.
Covid-19 and financial hardship in London,2g98r,"At the end of 2020 the GLA commissioned the University of Essex to a nalyse the impact on Londoners of the Covid-19 crisis, of the emergency policies put in...","At the end of 2020 the GLA commissioned the University of Essex to a nalyse the impact on Londoners of the Covid-19 crisis, of the emergency policies put in place since March 2020 and of some counterfactual policy options, including the continuation of the £20 weekly uplift in Universal Credit and Working Tax Credit. The researchers used UKMOD , the UK tax-benefit microsimulation model, to conduct their analysis.",Health,Greater London Authority (GLA),https://data.london.gov.uk/dataset/2g98r,UK Open Government Licence (OGL v3) — http://www.nationalarchives.gov.uk/doc/open-government-licence/version/3/,One off,PDF,UNKNOWN,UNKNOWN,Greater London,Free download,UNKNOWN — requires accessing dataset page directly,UNKNOWN — requires accessing dataset page directly,,snowflake,Medium,"Topics: covid-19, demographics, income-poverty-welfare. Last updated: 2021-09-24."
Coronavirus (COVID-19) Vaccine Roll Out,2zpdy,"Vaccinations in London Between 8 December 2020 and 15 September 2021 5,838,305 1st doses and 5,232,885 2nd doses have been administered to London residents....","Vaccinations in London Between 8 December 2020 and 15 September 2021 5,838,305 1st doses and 5,232,885 2nd doses have been administered to London residents. Differences in vaccine roll out between London and the Rest of England London Rest of England Priority Group Vaccinations given Percentage vaccinated Vaccinations given Percentage vaccinated Group 1 Older Adult Care Home Residents 21,883 95% 275,964 96% Older Adult Care Home Staff 29,405 85% 381,637 88% Group 2 80+ years 251,021 83% 2,368,284 93% Health Care Worker 174,944 99% 1,139,243 100%* Group 3 75 - 79 years 177,665 90% 1,796,408 99% Group 4 70 - 74 years 252,609 90% 2,454,381 97% Clinically Extremely Vulnerable 278,967 88% 1,850,485 95% Group 5 65 - 69 years 285,768 90% 2,381,250 97% Group 6 At Risk or Carer (Under 65) 983,379 7",Health,Greater London Authority (GLA),https://data.london.gov.uk/dataset/2zpdy,UNKNOWN,Monthly,UNKNOWN,UNKNOWN,UNKNOWN,Greater London,Free download,UNKNOWN — requires accessing dataset page directly,UNKNOWN — requires accessing dataset page directly,,snowflake,Medium,Topics: covid-19. Last updated: 2021-09-16.
Socio-economic impact of COVID-19,2zpyn,This briefing presents evidence on the socio-economic impact of COVID-19 on London and Londoners​ Topics included in the briefing focus on recent data...,This briefing presents evidence on the socio-economic impact of COVID-19 on London and Londoners​ Topics included in the briefing focus on recent data releases published in the preceding months that tell us how social policy issues are evolving in London since the start of the COVID-19 pandemic For more on the health and demographic impacts see the Demographic Impact Briefing and for labour market impacts see Labour Market Analysis . A page linking to all Covid-19 related data and analyses can be found here.,Health,Greater London Authority (GLA),https://data.london.gov.uk/dataset/2zpyn,UK Open Government Licence (OGL v2) — http://www.nationalarchives.gov.uk/doc/open-government-licence/version/2/,Unknown,PDF,UNKNOWN,UNKNOWN,Greater London,Free download,UNKNOWN — requires accessing dataset page directly,UNKNOWN — requires accessing dataset page directly,"healthcare, Demography, employment, economic activity, Education, housing, health, population",snowflake,Medium,"Topics: covid-19, demographics, education, health, housing. Last updated: 2021-07-09."
London Community Response Survey,2g971,This dataset presents results of a weekly questionnaire sent to a cohort of frontline civil society organisations from April 2020. The results are being...,"This dataset presents results of a weekly questionnaire sent to a cohort of frontline civil society organisations from April 2020. The results are being used alongside a range of other pieces of intelligence to inform the pan-London response to the COVID-19 pandemic. The week one questionnaire asked organisations a number of profile questions to understand more about the work they do. Questionnaires from week two onwards have asked organisations about patterns of need they are seeing amongst their beneficiary groups in the last week. Responses to these questions are linked back to the week one profile questions, where possible, to understand how responses vary between different types of organisations. This is also an ongoing 'on-boarding' questionnaire sent to new members of the cohort. Th",Health,Greater London Authority (GLA),https://data.london.gov.uk/dataset/2g971,UK Open Government Licence (OGL v3) — http://www.nationalarchives.gov.uk/doc/open-government-licence/version/3/,Weekly,PDF,UNKNOWN,UNKNOWN,Region,Free download,UNKNOWN — requires accessing dataset page directly,UNKNOWN — requires accessing dataset page directly,,snowflake,Medium,Topics: covid-19. Last updated: 2021-05-10.
COVID-19 online diaries,em5o5,"The Opinion Research team set up an online diary to capture the views, behaviours and experiences of a sample of Londoners during the coronavirus outbreak....","The Opinion Research team set up an online diary to capture the views, behaviours and experiences of a sample of Londoners during the coronavirus outbreak. Commencing in late May, this online diary ran for 8 weeks. Fortnightly summary reports can be found accessed below, and included: Week 1 and 2 – reflected on experiences during lockdown to date and explored views on easing lockdown. Week 3 and 4 – explored priorities for London’s recovery, both short and long-term, and views on the Test and Trace system. Week 5 and 6 – explored growing disengagement with the coronavirus outbreak and reflected on some of the positive impacts of lockdown.​ Week 7 and 8 – explored the idea of a 15-minute city and aspirations for the future of London.",Health,GLA Opinion Research,https://data.london.gov.uk/dataset/em5o5,UNKNOWN,Unknown,"HTML, PDF, SLIDESHOW",UNKNOWN,2020-05 to 2020-07,Greater London,Free download,UNKNOWN — requires accessing dataset page directly,UNKNOWN — requires accessing dataset page directly,,snowflake,Medium,Topics: covid-19. Last updated: 2020-12-22.
Wider impacts of the COVID-19 pandemic and recovery of population health outcomes for London,v8w87,"These documents were produced through a collaboration between GLA, PHE London and Association of Directors of Public Health London. The wider impacts slide...","These documents were produced through a collaboration between GLA, PHE London and Association of Directors of Public Health London. The wider impacts slide set pulls together a series of rapid evidence reviews and consultation conversations with key London stakeholders. The evidence reviews and stakeholder consultations were undertaken to explore the wider impacts of the pandemic on Londoners and the considerations for recovery within the context of improving population health outcomes. The information presented in the wider impact slides represents the emerging evidence available at the time of conducting the work (May-August 2020). The resource is not routinely updated and therefore further evidence reviews to identify more recent research and evidence should be considered alongside this",Health,Greater London Authority (GLA),https://data.london.gov.uk/dataset/v8w87,UNKNOWN,One off,PDF,UNKNOWN,UNKNOWN,Greater London,Free download,UNKNOWN — requires accessing dataset page directly,UNKNOWN — requires accessing dataset page directly,,snowflake,Medium,"Topics: covid-19, health. Last updated: 2020-12-14."
Experiences of Food Insecurity amongst Older Londoners before and during COVID-19  ,2rqyw,"Qualitative research with older Londoners undertaken by the GLA exploring: The causes of food insecurity and malnutrition amongst older Londoners, including...","Qualitative research with older Londoners undertaken by the GLA exploring: The causes of food insecurity and malnutrition amongst older Londoners, including the impact of coronavirus The experiences of older Londoners experiencing food insecurity and its impact on general well-being The extent to which the diets (including water intake) of older Londoners are monitored/discussed The extent to which older Londoners understand and/or think about their nutritional needs",Health,Greater London Authority (GLA),https://data.london.gov.uk/dataset/2rqyw,UK Open Government Licence (OGL v3) — http://www.nationalarchives.gov.uk/doc/open-government-licence/version/3/,One off,PDF,UNKNOWN,UNKNOWN,Region,Free download,UNKNOWN — requires accessing dataset page directly,UNKNOWN — requires accessing dataset page directly,,snowflake,Medium,"Topics: covid-19, health, income-poverty-welfare. Last updated: 2020-10-08."
Rapid Evidence Review - Inequalities in relation to COVID-19 and their effects on London,e751n,The Greater London Authority (GLA) commissioned the University of Manchester to conduct a rapid evidence review to document and understand the impact of...,"The Greater London Authority (GLA) commissioned the University of Manchester to conduct a rapid evidence review to document and understand the impact of COVID-19 (in terms of both health and the broader impacts on existing social and economic inequalities) on those with protected characteristics, as well as those living in poorer, or more precarious, socioeconomic circumstances, paying particular attention to its effect in London. The report provides the outcomes of the review, as well as a series of recommendations, which are focused on identifying tractable policy solutions in order to prevent, or mitigate, the inequalities in relation to protected characteristics and socioeconomic position that result from the COVID-19 pandemic and policy responses to it. Also available to download belo",Health,Greater London Authority (GLA),https://data.london.gov.uk/dataset/e751n,UK Open Government Licence (OGL v3) — http://www.nationalarchives.gov.uk/doc/open-government-licence/version/3/,One off,"PDF, SPREADSHEET",UNKNOWN,UNKNOWN,Greater London,Free download,UNKNOWN — requires accessing dataset page directly,UNKNOWN — requires accessing dataset page directly,,snowflake,Medium,"Topics: covid-19, demographics. Last updated: 2020-10-01."
GLA COVID-19 polling,e5nwg,This dataset outlines the latest research on public attitudes and behaviours in relation to the coronavirus outbreak. It includes the results of a tracker...,This dataset outlines the latest research on public attitudes and behaviours in relation to the coronavirus outbreak. It includes the results of a tracker poll which asks respondents the same questions each week to monitor how responses change over time. Additionally there is a supplementary fortnightly poll which includes questions not covered in the weekly tracker.,Health,GLA Opinion Research,https://data.london.gov.uk/dataset/e5nwg,Other (Not Open),Bi-weekly,SPREADSHEET,UNKNOWN,2019-08 to 2020-09,Greater London,Free download,UNKNOWN — requires accessing dataset page directly,UNKNOWN — requires accessing dataset page directly,highstreetdata,snowflake,Medium,"Topics: covid-19, health. Last updated: 2020-09-30."
COVID-19: socio-economic risk factors briefing,v8wrm,"Coronavirus affects some members of the population more than others. Emerging evidence suggests that older people, men, people with health conditions such...","Coronavirus affects some members of the population more than others. Emerging evidence suggests that older people, men, people with health conditions such as respiratory and pulmonary conditions, and people of a Black, Asian Minority Ethnic (BAME) background are at particular risk. There are also a number of other wider public health risk factors that have been found to increase the likelihood of an individual contracting coronavirus. This briefing presents descriptive evidence on a range of these factors, seeking to understand at a London-wide level the proportion of the population affected by each.",Health,Greater London Authority (GLA),https://data.london.gov.uk/dataset/v8wrm,UK Open Government Licence (OGL v3) — http://www.nationalarchives.gov.uk/doc/open-government-licence/version/3/,One off,PDF,UNKNOWN,UNKNOWN,Greater London,Free download,UNKNOWN — requires accessing dataset page directly,UNKNOWN — requires accessing dataset page directly,,snowflake,Medium,Topics: covid-19. Last updated: 2020-06-01.
COVID-19 Deaths Mapping Tool,204w9,"This mapping tool enables you to see how COVID-19 deaths in your area may relate to factors in the local population, which research has shown are associated...","This mapping tool enables you to see how COVID-19 deaths in your area may relate to factors in the local population, which research has shown are associated with COVID-19 mortality. It maps COVID-19 deaths rates for small areas of London (known as MSOAs) and enables you to compare these to a number of other factors including the Index of Multiple Deprivation, the age and ethnicity of the local population, extent of pre-existing health conditions in the local population, and occupational data. Research has shown that the mortality risk from COVID-19 is higher for people of older age groups, for men, for people with pre-existing health conditions, and for people from BAME backgrounds. London boroughs had some of the highest mortality rates from COVID-19 based on data to April 17th 2020, base",Health,Greater London Authority (GLA),https://data.london.gov.uk/dataset/204w9,UNKNOWN,Unknown,"IMAGE, SPREADSHEET",UNKNOWN,UNKNOWN,Greater London,Free download,UNKNOWN — requires accessing dataset page directly,UNKNOWN — requires accessing dataset page directly,,snowflake,Medium,Topics: covid-19. Last updated: 2020-05-31.
